combi,neta,turn,speech
エバース,野球肘,0,どうも、町田と佐々木でエバースと申します。お願いします。あの、お前さ、
エバース,野球肘,1,どうしました？
エバース,野球肘,2,古傷ってあるやろ？
エバース,野球肘,3,古傷。
エバース,野球肘,4,いや、実は僕ね、中学の時、野球部だったんですけど、その時、練習のし過ぎで野球肘やっちゃって。
エバース,野球肘,5,野球肘？（言葉遊びフリ）
エバース,野球肘,6,そうで、結局それが原因で部活もやめることになって。で、未だにっすよ、まだこの年になっても痛むこととかあるんすよ。結構しんどくて。
エバース,野球肘,7,野球肘？（言葉遊びフリ）
エバース,野球肘,8,そう、野球肘。
エバース,野球肘,9,え、野球肘？（言葉遊びフリ）
エバース,野球肘,10,うん、野球肘。
エバース,野球肘,11,え、こうピッチャーが投げてきたボールを、こうバットの代わりに肘でこうやって打つやつ？（言葉遊び）
エバース,野球肘,12,うん、それは肘野球！俺が言ってるのは野球肘！
エバース,野球肘,13,肘野球。（失礼ボケフリ）
エバース,野球肘,14,肘野球は、ピッチャーが投げた弾をこうやって肘で打ち返す野球のことだ。（失礼ボケフリ）
エバース,野球肘,15,辛い学生時代だったんだ。（失礼ボケ）
エバース,野球肘,16,やらされてねえ！ヤンキーに「お前だけ肘で打て」とか言われてねえ！
エバース,野球肘,17,あ、そうなの？でも、野球肘っていう言葉、おかしくない？
エバース,野球肘,18,何が？
エバース,野球肘,19,だって、野球にまつわる言葉ってプロ野球とか草野球とか、後半に「野球」っていう単語がつくと思うけど。
エバース,野球肘,20,うん、それは野球がメインの話。プロがやってる野球、プロ野球。俺が言ってるのは、野球で痛めた肘、野球肘。俺の肘は野球肘です！
エバース,野球肘,21,俺の肘は野球肘です…イチローの前でも言える？（失礼ボケフリ）
エバース,野球肘,22,何がだよ？
エバース,野球肘,23,いや、その、気悪くしないで聞いて欲しいんだけど、中学で野球辞めた分際でね、その自分の肘を野球肘って呼ぶのは、いささか傲慢なんじゃない？（失礼ボケ）
エバース,野球肘,24,そういう意味で言ってねえ！俺別に、イチローとか大谷に差し置いて「俺の肘こそが野球肘だ」って言ってるわけじゃねえ！ちゃんと病名であんの。
エバース,野球肘,25,病名？
エバース,野球肘,26,野球で痛めた肘は野球肘、テニスで痛めた肘はテニス肘。こう名前がついてる。
エバース,野球肘,27,あ、なるほどね。こう、何かで痛めたら「〇〇肘」っていう名前になるんだ。
エバース,野球肘,28,そういうこと。
エバース,野球肘,29,板前さんってさ、1日に何百貫ってお寿司握ってるから、肘への負担が半端じゃないっていうのはよく言うよね。
エバース,野球肘,30,うん、まあ、それは初耳だけど、負担かかるかも。
エバース,野球肘,31,その場合は、板前さん何肘なんの？（言葉遊びフリ）
エバース,野球肘,32,じゃあ、その場合は寿司肘だな。
エバース,野球肘,33,寿司肘？（言葉遊びフリ）
エバース,野球肘,34,うん、聞いたことはないけどね。
エバース,野球肘,35,肘寿司じゃなくて？（言葉遊び）
エバース,野球肘,36,肘寿司じゃねえ！肘寿司って何？
エバース,野球肘,37,肘寿司は、肘の上に寿司が乗ってるお寿司。これが肘寿司？
エバース,野球肘,38,食いてえ！
エバース,野球肘,39,食いてえってんだ。食いたくはねえだろ絶対。
エバース,野球肘,40,それ誰の肘なの？
エバース,野球肘,41,そんなん板前だろ！
エバース,野球肘,42,じゃあ、板前さんが自分でこうシャリ握って、その上に肘乗せて肘寿司って作るの？
エバース,野球肘,43,肘寿司があるとしたらそうなんじゃない？
エバース,野球肘,44,もうお寿司握れないじゃん。
エバース,野球肘,45,そうだよ、
エバース,野球肘,46,じゃあ最後のお寿司じゃん。
エバース,野球肘,47,「我が寿司人生に悔いはなし！」じゃん。
エバース,野球肘,48,それ、へいお待ちって出されて、これ食べんの？
エバース,野球肘,49,俺が頼んだんだったら食べるよ。肘を食べます。
エバース,野球肘,50,え、じゃあ板前さん肘痛めちゃうじゃん。（言葉遊びフリ）
エバース,野球肘,51,肘痛めちゃう。
エバース,野球肘,52,じゃあ、この場合は町田のせいで肘痛めてるから町田肘ってこと？（言葉遊びフリ）
エバース,野球肘,53,そう。
エバース,野球肘,54,あ、そう。
エバース,野球肘,55,それであってる。だって町田によって肘痛めてるから、町田肘で合ってる。
エバース,野球肘,56,え、肘町田じゃなくて？（言葉遊び）
エバース,野球肘,57,肘町田じゃねえ！
エバース,野球肘,58,じゃ、肘町田って何？（リアルボケフリ）
エバース,野球肘,59,肘町田は、俺の肘の写真が何百枚も並べられてて、それを引いてみた時にでっかい一枚の町田になってる。ザ・肘町田！それをTシャツにして着るんだ。（リアルボケ）
エバース,野球肘,60,着て～！
エバース,野球肘,61,着て～って何だよ。どうも、ありがとうございました。
ランジャタイ,谷村新司,0,谷村新司を知っているかい？
ランジャタイ,谷村新司,1,もちろん、 国民的スターね？（失礼ボケフリ）
ランジャタイ,谷村新司,2,やつが好きでね（失礼ボケ）
ランジャタイ,谷村新司,3,やつって言わないで
ランジャタイ,谷村新司,4,谷村新司さん、あの人の、あの背中に憧れて、追いかけて、なりたいと思って、やってきてるから。
ランジャタイ,谷村新司,5,なんで歌手やらないの？
ランジャタイ,谷村新司,6,芸人ならなれると思って（裏切りボケ）
ランジャタイ,谷村新司,7,芸人じゃなれませんよ
ランジャタイ,谷村新司,8,いいですか？今日この会場に来たら谷村新司になれると聞いてやって参りました（なりきりボケフリ）
ランジャタイ,谷村新司,9,間違った情報ですそれは
ランジャタイ,谷村新司,10,何回でも言います僕は。なれると聞いてやって参りました（なりきりボケフリ）
ランジャタイ,谷村新司,11,情報間違ってる
ランジャタイ,谷村新司,12,みんなはもうなれたかな 谷村新司になれたかな？（なりきりボケフリ）
ランジャタイ,谷村新司,13,そういうつもりで集まったメンバーじゃない
ランジャタイ,谷村新司,14,10年間、必死に頑張ってなりたいと思ってやってきました。谷村新司。ならせていただこうと思います（なりきりボケフリ）
ランジャタイ,谷村新司,15,誰に言ってんの？
ランジャタイ,谷村新司,16,全、谷村新司に告ぐ（なりきりボケ）
ランジャタイ,谷村新司,17,一人しかいない
ランジャタイ,谷村新司,18,今日から僕が谷村新司だ（なりきりボケ）
ランジャタイ,谷村新司,19,どういうこと？
ランジャタイ,谷村新司,20,ちょっと準備の方させてください。あああ。お前は誰かって聞いてるよ？お前は誰なんだ？（暴走ボケフリ）
ランジャタイ,谷村新司,21,自問自答？
ランジャタイ,谷村新司,22,谷村新司だ（なりきりボケ）（暴走ボケ）
ランジャタイ,谷村新司,23,違う
ランジャタイ,谷村新司,24,そうだぞ。谷村新司だぞ。谷村新司。だぞ？はっはっはっ！ちょび髭ついてるか？（なりきりボケ）（暴走ボケ）
ランジャタイ,谷村新司,25,ついてないよ
ランジャタイ,谷村新司,26,ちょび髭はついてるかい？（ちょび髭だけが動く）右か左か？（暴走ボケ）（動きボケ）
ランジャタイ,谷村新司,27,右だよ右
ランジャタイ,谷村新司,28,こっちだ（ちょび髭の方に顔を近づける）谷村、谷村新司（暴走ボケ）（動きボケ）
ランジャタイ,谷村新司,29,（ちょび髭を持たされる）
ランジャタイ,谷村新司,30,（ちょび髭に向かって走る）谷村、あーうっ！ポウ！（暴走ボケ）（動きボケ）（なりきりボケ）
ランジャタイ,谷村新司,31,マイケル？
ランジャタイ,谷村新司,32,（ちょび髭が取れることに驚く）（動きボケ）（なりきりボケ）
ランジャタイ,谷村新司,33,あ、びっくりした
ランジャタイ,谷村新司,34,どーも、あしたー
モグライダー,マイケルじゃんけん,0,マイケルジャクソン 知ってますか？
モグライダー,マイケルじゃんけん,1,そりゃ知ってるよ。世界で一番売れたでしょあの人
モグライダー,マイケルじゃんけん,2,King of コック ですね（言葉遊び）
モグライダー,マイケルじゃんけん,3,キングオブポップだよ。マイケルジャクソン。 何マイケルがどうしたの？
モグライダー,マイケルじゃんけん,4,マイケルが死んでもう10年以上経ってるんですよ（動きボケ）
モグライダー,マイケルじゃんけん,5,そんな経つか。10を形で出すなよ気持ち悪いな。こうでいいだろ10なら
モグライダー,マイケルじゃんけん,6,だから今の子供達はマイケルの偉大さを知らないんですよ
モグライダー,マイケルじゃんけん,7,まあ見たことない子が多いだろうね.。もったいないね
モグライダー,マイケルじゃんけん,8,そういう子どもたちに偉大さを伝えるための「マイケルじゃんけん」というのを考えてきたから
モグライダー,マイケルじゃんけん,9,おう
モグライダー,マイケルじゃんけん,10,一緒にやりましょう
モグライダー,マイケルじゃんけん,11,なんか良さそうじゃん。グーチョキパーがマイケルの動きになってるみたいな（なりきりボケフリ）
モグライダー,マイケルじゃんけん,12,そう
モグライダー,マイケルじゃんけん,13,楽しそう、教えてよ。マイケルのグーは？
モグライダー,マイケルじゃんけん,14,ポウ！（キャラボケフリ）
モグライダー,マイケルじゃんけん,15,マイケルって言ったらポウだもんね。チョキは？
モグライダー,マイケルじゃんけん,16,アァオ！（キャラボケフリ）
モグライダー,マイケルじゃんけん,17,アァオもイメージあるね。パーは？
モグライダー,マイケルじゃんけん,18,ンンンアァ！（キャラボケフリ）
モグライダー,マイケルじゃんけん,19,こっちのタイプが張らない方の。癇癪持ちみたいな時あるもんね。グーチョキパーで何作ろうみたいな歌あるじゃん？ああいうので教えたら子供覚えやすいんじゃない？ちょっと歌うからやってよ。さんハイ、グーチョキパーで、グーチョキパーで（キャラボケフリ）
モグライダー,マイケルじゃんけん,20,ポウ！アァオ！ンンンアァ、ポウ！アァオ！ンンンアァ（キャラボケ）
モグライダー,マイケルじゃんけん,21,やめてよやだなー。アァオ！アァーオって言ってるよ？ チョキチョーキになってるよ。パーやってないよ。パーは？パーは？
モグライダー,マイケルじゃんけん,22,パァーオ（キャラボケ）
モグライダー,マイケルじゃんけん,23,パァーオなんてなかったじゃん。パーが？パーが？
モグライダー,マイケルじゃんけん,24,ンンンアァ
モグライダー,マイケルじゃんけん,25,パーがグーぽいからややこいんだよ。 グーノーマルの2個出してるんだから。こっちがグーでこっちをパーにしたら？
モグライダー,マイケルじゃんけん,26,あぁ、なるほどね
モグライダー,マイケルじゃんけん,27,それで行こう。さんハイ。グーチョキパーで
モグライダー,マイケルじゃんけん,28,ポウ！パーン、ンンンアァ（キャラボケ）（動きボケ）
モグライダー,マイケルじゃんけん,29,くちゃくちゃじゃねえか、ずーっと
モグライダー,マイケルじゃんけん,30,なに作ろう？（キャラボケ）
モグライダー,マイケルじゃんけん,31,できないよまだ何もそんなんじゃ
モグライダー,マイケルじゃんけん,32,なに作ろう？右手がポウ！で左手がアァオ！でカタツムリ（キャラボケ）（動きボケ）
モグライダー,マイケルじゃんけん,33,アァオ！が上に来るわけねえだろ気持ちわりー
錦鯉,深夜の通販番組,0,どうもー！こんにちはー！
錦鯉,深夜の通販番組,1,うるせぇんだよ
錦鯉,深夜の通販番組,2,一文なし、参上！（自虐ボケ）
錦鯉,深夜の通販番組,3,持ってこいよ。錦鯉です、お願いします
錦鯉,深夜の通販番組,4,お願いしまーす。ありがとうございますー。俺さ、深夜の通販番組やりたいんだよね
錦鯉,深夜の通販番組,5,あ、いいね。俺もやりたいよそれ
錦鯉,深夜の通販番組,6,ね？ちょっと見てて。
錦鯉,深夜の通販番組,7,おう
錦鯉,深夜の通販番組,8,よお！みんなごきげんいかが？俺はとってもご機嫌だぜえ。ハッハッハッハッハッハー（なりきりボケフリ）
錦鯉,深夜の通販番組,9,まさかの外人タイプじゃねーかよお前
錦鯉,深夜の通販番組,10,俺の名はまさのり。みんな、とんでもねえブタ野郎って呼んでくれ（自虐ボケ）
錦鯉,深夜の通販番組,11,呼びづれーよ。おめえが気持ちいいだけじゃねーかよ
錦鯉,深夜の通販番組,12,最初の商品はこちら。パーソナルコンピューター。略してナルプ（裏切りボケ）
錦鯉,深夜の通販番組,13,どこ取ってんだよお前
錦鯉,深夜の通販番組,14,こちらのノートナルプ
錦鯉,深夜の通販番組,15,パソコンって言えよ
錦鯉,深夜の通販番組,16,なんと開いたり、閉じたりできるんだぜえ（なりきりボケ）
錦鯉,深夜の通販番組,17,そういうもんなんだ
錦鯉,深夜の通販番組,18,何度でも開いたり閉じたりできるんだ（なりきりボケ）
錦鯉,深夜の通販番組,19,もっと機能の説明とかしろって
錦鯉,深夜の通販番組,20,そして、開いた下には。わーお！ボタンがいっぱいだあ（なりきりボケ）
錦鯉,深夜の通販番組,21,見たことねえのかよお前。パソコン、一回見てこいよ
錦鯉,深夜の通販番組,22,こんなにボタンがいっぱいなんて電卓以来だよね（なりきりボケ）
錦鯉,深夜の通販番組,23,何と比べちゃってんだよ
錦鯉,深夜の通販番組,24,おっと失礼！歯が抜けた（自虐ボケ）（失礼ボケフリ）
錦鯉,深夜の通販番組,25,じゃあ帰れよお前。歯抜けた奴は帰れよもう
錦鯉,深夜の通販番組,26,さあ！本日は特別サービス、こちらの抜けた歯も付けちゃおう（失礼ボケ）
錦鯉,深夜の通販番組,27,タダにしろ、タダにしろこれ
錦鯉,深夜の通販番組,28,さあ、次の商品はこちら
錦鯉,深夜の通販番組,29,なんだ？
錦鯉,深夜の通販番組,30,みんなー、健康に気をつかってるかい？はあ！血だ（裏切りボケ）
錦鯉,深夜の通販番組,31,お前がつかえよ。心配だよ
錦鯉,深夜の通販番組,32,さあ商品はこちら
錦鯉,深夜の通販番組,33,なに？
錦鯉,深夜の通販番組,34,緑色の憎いやつだ
錦鯉,深夜の通販番組,35,青汁かなこれは？
錦鯉,深夜の通販番組,36,早速、飲んでみよう。うぐうぐうぐ（飲む）、ダメだあ〜（失礼ボケ）
錦鯉,深夜の通販番組,37,ダメだは言っちゃダメだよ。不味いまでだよ
錦鯉,深夜の通販番組,38,これはダメだー！（失礼ボケ）
錦鯉,深夜の通販番組,39,ダメだは言っちゃダメだって
錦鯉,深夜の通販番組,40,ウムウム（飲む）…ダメだー！（かぶせ）
錦鯉,深夜の通販番組,41,ダメだは言っちゃダメだめなの
錦鯉,深夜の通販番組,42,さあ、こちらのダメ汁（失礼ボケ）
錦鯉,深夜の通販番組,43,うるせーよお前
錦鯉,深夜の通販番組,44,本日は特別サービス。赤汁と黄汁も付けちゃおう（スカシボケフリ）
錦鯉,深夜の通販番組,45,なんだよ赤汁と黄汁っていうのはよ
錦鯉,深夜の通販番組,46,さあ次の商品はこちら（スカシボケ）
錦鯉,深夜の通販番組,47,赤汁と黄汁は何？
錦鯉,深夜の通販番組,48,これが最後の商品だ（スカシボケ）
錦鯉,深夜の通販番組,49,まずは赤汁と黄汁の説明からだよお前。なんなんだよ
錦鯉,深夜の通販番組,50,最後の商品はこちら
錦鯉,深夜の通販番組,51,なに？
錦鯉,深夜の通販番組,52,せの7、せの7です（リアルボケフリ）
錦鯉,深夜の通販番組,53,なんだせの7って
錦鯉,深夜の通販番組,54,こちら魚民中野店の靴箱で使えます（リアルボケ）
錦鯉,深夜の通販番組,55,返してこいよ。1人入れねえじゃねえかよお前よ
錦鯉,深夜の通販番組,56,さらに特別サービス！こちら、まの4も付けちゃおう（リアルボケ）
錦鯉,深夜の通販番組,57,2人入れねえじゃねーかよ、魚民の客単価が心配だよ
錦鯉,深夜の通販番組,58,さあ、本日の商品はここまでだ。クソして寝な！（なりきりボケ）
錦鯉,深夜の通販番組,59,口がわりーよ、全然できないじゃん通販。無理だよ
錦鯉,深夜の通販番組,60,わかってたよ。俺が通販番組できないなんてさ。みんなもわかってたんだろう？わかっててわざと俺を泳がせて、あざ笑って。でも気にしないで、それが人間だから（キャラボケ）
錦鯉,深夜の通販番組,61,うるせーよ。どうもありがとう
TEAM BANANA,一周回って,0,どうもー
TEAM BANANA,一周回って,1,チームバナナです
TEAM BANANA,一周回って,2,お願いしまーす
TEAM BANANA,一周回って,3,私が山田と言いまして、
TEAM BANANA,一周回って,4,はい、藤本でーす
TEAM BANANA,一周回って,5,お願いしまーす
TEAM BANANA,一周回って,6,最近さ、私痩せようかなと思ってんの（リアルボケフリ）
TEAM BANANA,一周回って,7,え？どうしたの急に
TEAM BANANA,一周回って,8,こないださ、痩せたら可愛いと言われたのよ（リアルボケフリ）
TEAM BANANA,一周回って,9,あのー、嬉しそうにしてるとこ申し訳ないけど、太ってる人だいたい言われたことあるよ（リアルボケ）
TEAM BANANA,一周回って,10,ん？
TEAM BANANA,一周回って,11,うん。デブには痩せたら可愛い。ブスには肌キレイ。これ決まってるから（リアルボケ）
TEAM BANANA,一周回って,12,決まってんの？
TEAM BANANA,一周回って,13,決まってる。そろそろ義務教育で教えるんじゃないかってレベル（大げさボケ）
TEAM BANANA,一周回って,14,そんなに決まってる？
TEAM BANANA,一周回って,15,そんなに決まってるよ
TEAM BANANA,一周回って,16,中でも、私は痩せたら可愛いんじゃないかなぁと思ってんだけど（失礼ボケフリ）
TEAM BANANA,一周回って,17,いや藤本はね、痩せたらね、普通（失礼ボケ）
TEAM BANANA,一周回って,18,普通？
TEAM BANANA,一周回って,19,ブスじゃないですよね？もう普通、中の中ジャストって感じよ（失礼ボケ）
TEAM BANANA,一周回って,20,まあでもね、私にはねどうしても痩せたい理由があるんですよ
TEAM BANANA,一周回って,21,えー？しつこい。なんでそんな痩せたいの？
TEAM BANANA,一周回って,22,私ね、痩せて絶対福士蒼汰くんと付き合いたいの
TEAM BANANA,一周回って,23,理由キモすぎて吐いちゃいそうです（なりきりボケ）
TEAM BANANA,一周回って,24,うそうそうそうそ？でも私、本気で言ってるよ
TEAM BANANA,一周回って,25,まあでも、本気で言ってんだったら本気でアドバイスはしてもらうわ
TEAM BANANA,一周回って,26,なになになになに？
TEAM BANANA,一周回って,27,本気で福士蒼汰くんと付き合いたいんだったら、絶対に痩せたらダメよ（リアルボケフリ）
TEAM BANANA,一周回って,28,なんでー？
TEAM BANANA,一周回って,29,一周回ってチャンスってのがあるんじゃないかな（リアルボケフリ）
TEAM BANANA,一周回って,30,一周回ってチャンス？なにそれ？
TEAM BANANA,一周回って,31,分かんない？
TEAM BANANA,一周回って,32,分かんない
TEAM BANANA,一周回って,33,超絶イケメンが美人とばっかり付き合い過ぎて、美人に飽きて一周回ってデブとかブスとかと付き合うというありがたーいあれ（リアルボケ）
TEAM BANANA,一周回って,34,ありがたーい！なにそれ！
TEAM BANANA,一周回って,35,なんか街とかで見たことありません？すごいイケメンと「えっ？えっ？えーっ？」みたいな。女が手つないで歩いてるの（リアルボケ）
TEAM BANANA,一周回って,36,見たことある。え、でもさ何でそういうことが起こんのよ？
TEAM BANANA,一周回って,37,行き過ぎた人間ってのはね、時に訳の分からない行動をしたりするもんなのよ（リアルボケ）（大げさボケ）
TEAM BANANA,一周回って,38,そうなの？
TEAM BANANA,一周回って,39,そうそうそう。絶対痩せたらダメよ。痩せるってことは唯一の武器を捨てるってこと（失礼ボケフリ）。歌わないJUJU（失礼ボケ）
TEAM BANANA,一周回って,40,あ、絶対ダメじゃん
TEAM BANANA,一周回って,41,絶対ダメ。歌ってー！なるから。JUJUは歌ってーってなるから（失礼ボケ）
TEAM BANANA,一周回って,42,てことはさ、私何の努力もせずに、この姿のままで福士蒼汰くんと付き合える可能性があるってこと？（失礼ボケフリ）
TEAM BANANA,一周回って,43,あるってことよ（失礼ボケフリ）
TEAM BANANA,一周回って,44,嬉しいんだけどー
TEAM BANANA,一周回って,45,イェーイ！（失礼ボケフリ）
TEAM BANANA,一周回って,46,イェーイ！
TEAM BANANA,一周回って,47,ヤッター！（失礼ボケフリ）
TEAM BANANA,一周回って,48,ヤッター！
TEAM BANANA,一周回って,49,ドスコーイ！って（失礼ボケ）
TEAM BANANA,一周回って,50,ドスコイ？
TEAM BANANA,一周回って,51,ほら
TEAM BANANA,一周回って,52,まあまあいいんだけど、ドスコーイ！
TEAM BANANA,一周回って,53,いいじゃん、カッコいいじゃん
TEAM BANANA,一周回って,54,なにがカッコいんだろう？
TEAM BANANA,一周回って,55,カッコいいよー
TEAM BANANA,一周回って,56,まあでも嬉しいです。すごい嬉しい
TEAM BANANA,一周回って,57,あ、でも言い忘れちゃったんだけど、万が一福士蒼汰くんと付き合えたとしても（裏切りボケフリ）
TEAM BANANA,一周回って,58,うんうんうん
TEAM BANANA,一周回って,59,まあ最終的には、周りの目気にして痩せた美人と結婚するけどね（裏切りボケ）（リアルボケ）
TEAM BANANA,一周回って,60,最悪じゃん、いい加減にして
TEAM BANANA,一周回って,61,どうもありがとうございました
ぼる塾,モテたい,0,どうもー、ぼる塾でーす
ぼる塾,モテたい,1,お願いしまーす
ぼる塾,モテたい,2,私たちですね。小学校からの幼馴染のハルちゃんとアンリと。そして、
ぼる塾,モテたい,3,私とアンリは25歳で田辺さんだけ36歳なんですよ（自虐ボケフリ）
ぼる塾,モテたい,4,はい、でたーーー！すぐに若さアピールする女ー！（自虐ボケフリ）
ぼる塾,モテたい,5,私たちが田辺さんに勝てるのは若さだけなんですよー
ぼる塾,モテたい,6,まあねー。最近私すぐ疲れちゃうの。なのに毎朝5時には必ず目が覚めちゃうわ（自虐ボケ）
ぼる塾,モテたい,7,だいぶババアだ
ぼる塾,モテたい,8,はーい
ぼる塾,モテたい,9,ちょっと聞いてくださいよ
ぼる塾,モテたい,10,なによ？
